{
  "schema_version": "pgx-scientific-source-registry/1",
  "generated_note": "Hand-authored candidate registry (WP-05). Every entry is PENDING_REVIEW with every reuse dimension UNKNOWN and no licence identifier, because no official terms document has been retrieved and no named human has reviewed any source. This is the correct default state, not an unfinished one: the project publishes nothing until these records are completed and reviewed. Do not set an approving status here - a record claiming approval without a review naming a human, an instant and cited evidence is refused at load time.",
  "policy_owner": "PGx Platform maintainers (document owner; not an approver)",
  "sources": [
    {
      "source_key": "aha.publications",
      "display_name": "AHA scientific statements",
      "role": "PRIMARY_GUIDELINE",
      "status": "PENDING_REVIEW",
      "acquisition_mode": "NOT_DETERMINED",
      "provider": "American Heart Association",
      "jurisdiction": null,
      "version_policy": null,
      "citation_policy": null,
      "license_identifier": null,
      "reuse": {
        "LOCAL_STORAGE": "UNKNOWN",
        "INTERNAL_ANALYSIS": "UNKNOWN",
        "DERIVED_WORK_CREATION": "UNKNOWN",
        "AGGREGATED_REDISTRIBUTION": "UNKNOWN",
        "VERBATIM_REDISTRIBUTION": "UNKNOWN",
        "COMMERCIAL_USE": "UNKNOWN",
        "AUTOMATED_ACQUISITION": "UNKNOWN",
        "BULK_DOWNLOAD": "UNKNOWN",
        "THIRD_PARTY_SHARING": "UNKNOWN",
        "PUBLIC_DISPLAY": "UNKNOWN"
      },
      "permitted_claim_categories": [],
      "evidence": [
        {
          "evidence_type": "NOT_OBTAINED",
          "official_url": null,
          "retrieved_at": null,
          "content_hash": null,
          "summary": null,
          "verification": "NOT_ATTEMPTED",
          "blocked_reason": null
        }
      ],
      "interpretation": null,
      "review": null,
      "legacy_aliases": [
        "AHA"
      ],
      "blocking_reasons": [
        "Every reuse dimension is UNKNOWN.",
        "No acquisition mode has been decided.",
        "No named human reviewer has made a decision.",
        "No official terms, licence or use-conditions document has been retrieved.",
        "No project interpretation of this source's terms has been written."
      ],
      "notes": "1 legacy guideline row carries the string 'AHA'.",
      "active": true
    },
    {
      "source_key": "ausnz.publications",
      "display_name": "AusNZ consensus recommendations",
      "role": "PRIMARY_GUIDELINE",
      "status": "PENDING_REVIEW",
      "acquisition_mode": "NOT_DETERMINED",
      "provider": "Australian and New Zealand consensus group",
      "jurisdiction": null,
      "version_policy": null,
      "citation_policy": null,
      "license_identifier": null,
      "reuse": {
        "LOCAL_STORAGE": "UNKNOWN",
        "INTERNAL_ANALYSIS": "UNKNOWN",
        "DERIVED_WORK_CREATION": "UNKNOWN",
        "AGGREGATED_REDISTRIBUTION": "UNKNOWN",
        "VERBATIM_REDISTRIBUTION": "UNKNOWN",
        "COMMERCIAL_USE": "UNKNOWN",
        "AUTOMATED_ACQUISITION": "UNKNOWN",
        "BULK_DOWNLOAD": "UNKNOWN",
        "THIRD_PARTY_SHARING": "UNKNOWN",
        "PUBLIC_DISPLAY": "UNKNOWN"
      },
      "permitted_claim_categories": [],
      "evidence": [
        {
          "evidence_type": "NOT_OBTAINED",
          "official_url": null,
          "retrieved_at": null,
          "content_hash": null,
          "summary": null,
          "verification": "NOT_ATTEMPTED",
          "blocked_reason": null
        }
      ],
      "interpretation": null,
      "review": null,
      "legacy_aliases": [
        "AusNZ"
      ],
      "blocking_reasons": [
        "Every reuse dimension is UNKNOWN.",
        "No acquisition mode has been decided.",
        "No named human reviewer has made a decision.",
        "No official terms, licence or use-conditions document has been retrieved.",
        "No project interpretation of this source's terms has been written."
      ],
      "notes": "1 legacy guideline row carries the string 'AusNZ'. Which group published it is not recorded in the legacy data.",
      "active": true
    },
    {
      "source_key": "clinpgx.api",
      "display_name": "ClinPGx public API",
      "role": "SUPPORTING_ANNOTATION",
      "status": "PENDING_REVIEW",
      "acquisition_mode": "NOT_DETERMINED",
      "provider": "ClinPGx",
      "jurisdiction": null,
      "version_policy": null,
      "citation_policy": null,
      "license_identifier": null,
      "reuse": {
        "LOCAL_STORAGE": "UNKNOWN",
        "INTERNAL_ANALYSIS": "UNKNOWN",
        "DERIVED_WORK_CREATION": "UNKNOWN",
        "AGGREGATED_REDISTRIBUTION": "UNKNOWN",
        "VERBATIM_REDISTRIBUTION": "UNKNOWN",
        "COMMERCIAL_USE": "UNKNOWN",
        "AUTOMATED_ACQUISITION": "UNKNOWN",
        "BULK_DOWNLOAD": "UNKNOWN",
        "THIRD_PARTY_SHARING": "UNKNOWN",
        "PUBLIC_DISPLAY": "UNKNOWN"
      },
      "permitted_claim_categories": [],
      "evidence": [
        {
          "evidence_type": "NOT_OBTAINED",
          "official_url": "https://api.clinpgx.org/",
          "retrieved_at": null,
          "content_hash": null,
          "summary": null,
          "verification": "BLOCKED",
          "blocked_reason": "Attempted 2026-08-30 from the WP-05 working environment; the request did not leave the network: URLError <urlopen error Tunnel connection failed: 403 Forbidden>. No terms, licence or API-conditions document has been read. This entry records an outstanding obligation, not a permission."
        }
      ],
      "interpretation": null,
      "review": null,
      "legacy_aliases": [
        "ClinPGx"
      ],
      "blocking_reasons": [
        "Every reuse dimension is UNKNOWN.",
        "No acquisition mode has been decided.",
        "No named human reviewer has made a decision.",
        "No official terms, licence or use-conditions document has been retrieved.",
        "No project interpretation of this source's terms has been written.",
        "Whether programmatic access is permitted at all, and under what rate and attribution conditions, is unknown."
      ],
      "notes": "The interface the frozen WP-01/WP-02 probes were written against. WP-04 built an adapter for it and made no live call; no call may be made until this record is approved.",
      "active": true
    },
    {
      "source_key": "clinpgx.website",
      "display_name": "ClinPGx web database",
      "role": "SUPPORTING_ANNOTATION",
      "status": "PENDING_REVIEW",
      "acquisition_mode": "NOT_DETERMINED",
      "provider": "ClinPGx",
      "jurisdiction": null,
      "version_policy": null,
      "citation_policy": null,
      "license_identifier": null,
      "reuse": {
        "LOCAL_STORAGE": "UNKNOWN",
        "INTERNAL_ANALYSIS": "UNKNOWN",
        "DERIVED_WORK_CREATION": "UNKNOWN",
        "AGGREGATED_REDISTRIBUTION": "UNKNOWN",
        "VERBATIM_REDISTRIBUTION": "UNKNOWN",
        "COMMERCIAL_USE": "UNKNOWN",
        "AUTOMATED_ACQUISITION": "UNKNOWN",
        "BULK_DOWNLOAD": "UNKNOWN",
        "THIRD_PARTY_SHARING": "UNKNOWN",
        "PUBLIC_DISPLAY": "UNKNOWN"
      },
      "permitted_claim_categories": [],
      "evidence": [
        {
          "evidence_type": "NOT_OBTAINED",
          "official_url": "https://www.clinpgx.org/",
          "retrieved_at": null,
          "content_hash": null,
          "summary": null,
          "verification": "BLOCKED",
          "blocked_reason": "Attempted 2026-08-30 from the WP-05 working environment; the request did not leave the network: URLError <urlopen error Tunnel connection failed: 403 Forbidden>. No terms, licence or API-conditions document has been read. This entry records an outstanding obligation, not a permission."
        }
      ],
      "interpretation": null,
      "review": null,
      "legacy_aliases": [],
      "blocking_reasons": [
        "Every reuse dimension is UNKNOWN.",
        "No acquisition mode has been decided.",
        "No named human reviewer has made a decision.",
        "No official terms, licence or use-conditions document has been retrieved.",
        "No project interpretation of this source's terms has been written.",
        "Scraping is prohibited by this project's own rules regardless of what the source permits; only an approved mechanism may be used."
      ],
      "notes": "The human-facing database behind the same provider's data. Registered separately from the API because a provider may publish different conditions for each.",
      "active": true
    },
    {
      "source_key": "cpic.api",
      "display_name": "CPIC API",
      "role": "PRIMARY_GUIDELINE",
      "status": "PENDING_REVIEW",
      "acquisition_mode": "NOT_DETERMINED",
      "provider": "Clinical Pharmacogenetics Implementation Consortium",
      "jurisdiction": null,
      "version_policy": null,
      "citation_policy": null,
      "license_identifier": null,
      "reuse": {
        "LOCAL_STORAGE": "UNKNOWN",
        "INTERNAL_ANALYSIS": "UNKNOWN",
        "DERIVED_WORK_CREATION": "UNKNOWN",
        "AGGREGATED_REDISTRIBUTION": "UNKNOWN",
        "VERBATIM_REDISTRIBUTION": "UNKNOWN",
        "COMMERCIAL_USE": "UNKNOWN",
        "AUTOMATED_ACQUISITION": "UNKNOWN",
        "BULK_DOWNLOAD": "UNKNOWN",
        "THIRD_PARTY_SHARING": "UNKNOWN",
        "PUBLIC_DISPLAY": "UNKNOWN"
      },
      "permitted_claim_categories": [],
      "evidence": [
        {
          "evidence_type": "NOT_OBTAINED",
          "official_url": null,
          "retrieved_at": null,
          "content_hash": null,
          "summary": null,
          "verification": "NOT_ATTEMPTED",
          "blocked_reason": null
        }
      ],
      "interpretation": null,
      "review": null,
      "legacy_aliases": [],
      "blocking_reasons": [
        "Every reuse dimension is UNKNOWN.",
        "No acquisition mode has been decided.",
        "No named human reviewer has made a decision.",